{
  "base": "OPENCORPORATES",
  "consulted_at": "2026-05-01T10:17:00-03:00",
  "queries_executed": 6,
  "status": "ok",
  "hits": [
    {
      "variation_matched": "Fontana Energy Partners LLC",
      "match_type": "exact",
      "source_id": "us_fl/L21000012345",
      "source_url": "https://opencorporates.com/companies/us_fl/L21000012345",
      "confidence": "confirmado",
      "raw_record": {
        "name": "Fontana Energy Partners LLC",
        "jurisdiction_code": "us_fl",
        "company_number": "L21000012345",
        "company_type": "Limited Liability Company",
        "incorporation_date": "2021-03-15",
        "dissolution_date": null,
        "current_status": "Active",
        "registered_address": "1200 Brickell Ave Ste 500, Miami, FL 33131, US",
        "opencorporates_url": "https://opencorporates.com/companies/us_fl/L21000012345",
        "source": "Florida Division of Corporations",
        "officers": [
          {"name": "Carlos Eduardo Fontana", "role": "agent", "start_date": "2021-03-15"}
        ]
      },
      "normalized": {
        "full_name": "Carlos Eduardo Fontana",
        "entity_name": "Fontana Energy Partners LLC",
        "address": "1200 Brickell Ave Ste 500, Miami, FL 33131",
        "state": "FL",
        "date": "2021-03-15",
        "entity_type": "LLC",
        "role": "agent"
      }
    },
    {
      "variation_matched": "Fontana Energy Partners LLC",
      "match_type": "exact",
      "source_id": "us_de/7654321",
      "source_url": "https://opencorporates.com/companies/us_de/7654321",
      "confidence": "confirmado",
      "raw_record": {
        "name": "Fontana Energy Partners LLC",
        "jurisdiction_code": "us_de",
        "company_number": "7654321",
        "company_type": "Limited Liability Company",
        "incorporation_date": "2021-02-28",
        "dissolution_date": null,
        "current_status": "Active",
        "registered_address": "1209 Orange Street, Wilmington, DE 19801, US",
        "opencorporates_url": "https://opencorporates.com/companies/us_de/7654321",
        "source": "Delaware Division of Corporations",
        "officers": []
      },
      "normalized": {
        "entity_name": "Fontana Energy Partners LLC",
        "address": "1209 Orange Street, Wilmington, DE 19801",
        "state": "DE",
        "date": "2021-02-28",
        "entity_type": "LLC"
      }
    },
    {
      "variation_matched": "Carlos Eduardo Fontana",
      "match_type": "exact",
      "source_id": "us_fl/officer/CEF-2021-001",
      "source_url": "https://opencorporates.com/officers/CEF-2021-001",
      "confidence": "provavel",
      "raw_record": {
        "name": "Carlos Eduardo Fontana",
        "role": "registered_agent",
        "company_name": "Fontana Energy Partners LLC",
        "company_jurisdiction": "us_fl",
        "company_number": "L21000012345",
        "start_date": "2021-03-15",
        "source": "Florida Division of Corporations"
      },
      "normalized": {
        "full_name": "Carlos Eduardo Fontana",
        "entity_name": "Fontana Energy Partners LLC",
        "state": "FL",
        "date": "2021-03-15",
        "role": "registered_agent"
      }
    }
  ],
  "no_hits": [
    "Fontana Carlos",
    "C. E. Fontana",
    "Mariana Silva Fontana",
    "Roberto Fontana"
  ],
  "legal_context": [
    "OpenCorporates agrega dados de registros corporativos públicos de mais de 140 jurisdições. A presença em múltiplas jurisdições americanas confirma a estrutura corporativa identificada nos registros estaduais individuais.",
    "O officer search da OpenCorporates usa correspondência exata de nome — variações podem não ser capturadas automaticamente."
  ],
  "next_frontiers": [
    "Expandir busca no OpenCorporates para jurisdições internacionais (Brasil, Cayman Islands, BVI) usando a mesma variação de nome",
    "Usar a API officer search para buscar Carlos Eduardo Fontana em todas as jurisdições disponíveis",
    "Verificar se há empresas no Brasil (CNPJ) com o mesmo nome via Receita Federal"
  ],
  "methodology_note": "Buscas via OpenCorporates API v0.4 (officer search e company search). Cobertura: 140+ jurisdições. Chave: OPENCORPORATES_API_KEY. Rate limit: 500 req/dia (plano gratuito)."
}
