{
  "base": "DE-CORPS",
  "consulted_at": "2026-05-01T10:13:00-03:00",
  "queries_executed": 5,
  "status": "ok",
  "hits": [
    {
      "variation_matched": "Fontana Energy Partners",
      "match_type": "substring",
      "source_id": "DE-7654321",
      "source_url": "https://icis.corp.delaware.gov/Ecorp/EntitySearch/NameSearch.aspx",
      "confidence": "confirmado",
      "raw_record": {
        "entity_name": "Fontana Energy Partners LLC",
        "file_number": "7654321",
        "entity_type": "Limited Liability Company",
        "incorporation_date": "2021-02-28",
        "state": "Delaware",
        "status": "Active",
        "registered_agent": "The Corporation Trust Company",
        "registered_office": "1209 Orange Street, Wilmington, DE 19801",
        "tax_status": "Good Standing"
      },
      "normalized": {
        "entity_name": "Fontana Energy Partners LLC",
        "address": "1209 Orange Street, Wilmington, DE 19801",
        "state": "DE",
        "date": "2021-02-28",
        "entity_type": "LLC"
      }
    }
  ],
  "no_hits": [
    "Carlos Eduardo Fontana",
    "Carlos Fontana",
    "C. E. Fontana",
    "Roberto Fontana"
  ],
  "legal_context": [
    "Delaware incorpora mais de 60% das Fortune 500 e é jurisdição preferida para offshores por proteção de privacidade — nomes de membros/gerentes de LLCs não são divulgados publicamente.",
    "O registered agent (The Corporation Trust Company) é genérico — praticamente toda offshore usa agentes profissionais em Delaware. Não indica vínculo com a empresa além da incorporação.",
    "Para identificar os 'ultimate beneficial owners' de uma Delaware LLC é necessário processo judicial ou solicitação à FinCEN sob o Corporate Transparency Act (vigente desde 01/01/2024)."
  ],
  "next_frontiers": [
    "Solicitar informações de UBO via Corporate Transparency Act (FinCEN BOI database) — válido para LLCs com receita < USD 5 mi e < 20 funcionários",
    "Verificar se a Fontana Energy Partners DE tem contratos com o governo federal via USASpending.gov",
    "Cruzar a data de incorporação em DE (2021-02-28) com a data de registro em FL (2021-03-15) para confirmar sequência: holding DE → operacional FL"
  ],
  "methodology_note": "Busca via Delaware ICIS Entity Name Search (icis.corp.delaware.gov). Limitação: Delaware não divulga nome de membros/gerentes de LLCs sem processo judicial. Cobertura: todas as entidades registradas no estado."
}
