{
  "base": "LDA",
  "consulted_at": "2026-05-01T14:02:00-05:00",
  "queries_executed": 8,
  "status": "ok",
  "hits": [],
  "no_hits": [
    "Pablo Vargas Mendoza",
    "Pablo Vargas",
    "Vargas Mendoza",
    "P. Vargas",
    "Vargas Energy USA LLC",
    "Vargas Energy USA",
    "Vargas Energia",
    "Vargas Energia S.A."
  ],
  "legal_context": [
    "O Lobbying Disclosure Act (2 U.S.C. § 1601 et seq.) exige registro de lobbyistas que representam clientes cujos honorários excedam USD 3.000 por trimestre. A ausência de registros pode indicar que: (a) nenhuma atividade de lobby foi realizada nos EUA; (b) a atividade ficou abaixo do threshold de registro; ou (c) a atividade foi registrada apenas no FARA se envolver um principal estrangeiro.",
    "A Vargas Energia S.A., como empresa peruana, seria considerada 'foreign principal' para fins de LDA. Se tivesse contratado lobbyista americano, o registro poderia ter sido feito no LDA como alternativa ao FARA, sob a isenção prevista em 22 U.S.C. § 613(h).",
    "Disclosure semestral: dados têm até 6 meses de defasagem. Atividade de lobby iniciada após junho de 2025 pode não estar publicada."
  ],
  "next_frontiers": [
    "Buscar em lda.senate.gov usando o nome da subsidiária 'Vargas Energy USA LLC' diretamente como cliente",
    "Verificar se alguma firma de governo e relações públicas (GR) em Washington D.C. listou Vargas Energia S.A. como cliente nos últimos 3 anos",
    "Cruzar com FARA: atividade de lobby que não aparece no LDA pode ter sido declarada no FARA"
  ],
  "methodology_note": "Buscas realizadas via lda.senate.gov/api/v1/filings. Cobertura: 2008-2026. Campos consultados: client_name e registrant_name (variações do alvo e das empresas vinculadas). Threshold de reporte: USD 3.000/trimestre."
}
